{
  "table_source": "projects/test_projects/hca_reproductive/routing/fibroblasts/routing_table.json",
  "notes": "Of the 37 requested cell sets, 27 have a readable upstream source and 10 do not. Six of the ten are ovarian (Mesen_OvarianFibs_InncorMedulla, _Perifol, _Outcor, _Medulla_SMCsLike, Mesen_OvarianFibs_AdvLike, Mesen_OvarianInclFibs) and all six are unreadable for the same reason: their contributor, celltype_OvarySanger2026, has no DOI. That one source put 179,450 cells into 21 of the 37 cell sets, including the single largest adult ovarian cell set in the selection (Mesen_OvarianFibs_InncorMedulla, 125,985 cells). No amount of reading reaches it. Any report on the adult ovarian fibroblast cell sets rests on the atlas paper alone, and that ceiling should be stated in those reports rather than discovered at synthesis time.\n\nThe selection splits cleanly into three blocks with different evidential characters, and the reading order follows them. (1) The fetal block (19 cell sets) is the strongest: Lorenzi 2025 names the same regional mesenchymal populations the atlas names, mostly one-to-one. (2) The endometrial block collapses into one enormous cell set (Endometrial functionalis stroma, 508,382 cells, 45% of the selection) whose 11 menstrual-phase children are exactly what the endometrial papers resolve; the atlas here is coarser than every one of its sources. (3) The adult fallopian/adventitial block is the weakest: its two dominant contributors both used a single generic stromal label, so reading them is expected to establish that the upstream studies did not make the distinctions the atlas makes, rather than to characterise anything.\n\nshare_of_subatlas_label is populated throughout, so both correspondence directions were available for this ranking.",
  "papers": [
    {
      "subatlas_paper": "celltype_Lorenzi2025",
      "doi": "10.1038/s41586-025-09875-2",
      "reason": "First by a wide margin. This is a developmental atlas of the same tract, and its labels are regional mesenchymal populations named the way the atlas names its fetal fibroblasts — so for most of the 19 fetal cell sets the atlas cell set and the Lorenzi label are the same population under two spellings, with both correspondence measures high at once (Labia, Glans, Corpus Cavernosum, Upper Vagina Mese, Fallopian Mese, Uterus Mese, Wolffian/Mesonephros Mese). It is the only readable source for Mesen_LabiaFib_Fetal, Mesen_GlansFib_Fetal, Mesen_Prepuce_Fetal, Mesen_LabioScrotalSwelling_Fetal, Mesen_CorpusCavernosumFib_Fetal, Mesen_CorpusSpongiosumFib_Fetal, Mesen_UGSFib_Lower and Mesen_UGSLig. The reading should establish, for each regional population, what defines it, where it sits, and how it relates to its neighbours — and separately settle three places where the atlas and Lorenzi disagree about where boundaries fall: the cervix, the urogenital sinus, and the external genital primordia.",
      "questions": [
        {
          "subatlas_cell_label": "Labia",
          "serves": [
            "Mesen_LabiaFib_Fetal"
          ],
          "ask": "Near-total correspondence in both directions and the only source for this cell set. Take the full characterisation: markers, anatomical location, developmental timing, and whether labial mesenchyme is held to be distinct from the labio-scrotal swelling it derives from."
        },
        {
          "subatlas_cell_label": "Glans",
          "serves": [
            "Mesen_GlansFib_Fetal",
            "Mesen_Prepuce_Fetal"
          ],
          "ask": "Sole source for glans fibroblasts. Also ask how glans and prepuce mesenchyme are distinguished, since a slice of this label went to the atlas's prepuce cell set and the Prepuce label returns the favour."
        },
        {
          "subatlas_cell_label": "Prepuce",
          "serves": [
            "Mesen_Prepuce_Fetal",
            "Mesen_LabioScrotalSwelling_Fetal",
            "Mesen_CorpusCavernosumFib_Fetal"
          ],
          "ask": "This label is the one external-genital population Lorenzi did NOT keep clean: it splits roughly three ways across the atlas's prepuce, labio-scrotal swelling and corpus cavernosum cell sets. Ask directly whether Lorenzi treats preputial mesenchyme as a distinct population or as a positional subset of the genital tubercle mesenchyme — the answer decides whether the atlas's three-way split has upstream support."
        },
        {
          "subatlas_cell_label": "Labio-Scrotal Swelling",
          "serves": [
            "Mesen_LabioScrotalSwelling_Fetal"
          ],
          "ask": "Sole clean source. Ask what distinguishes labio-scrotal swelling mesenchyme from labial and preputial mesenchyme, and whether sex-dimorphic differences are reported."
        },
        {
          "subatlas_cell_label": "Corpus Cavernosum",
          "serves": [
            "Mesen_CorpusCavernosumFib_Fetal"
          ],
          "ask": "Sole source and a clean one-to-one match. Full characterisation, plus how erectile-tissue mesenchyme is told from corpus spongiosum."
        },
        {
          "subatlas_cell_label": "Corpus Spongiosum",
          "serves": [
            "Mesen_CorpusSpongiosumFib_Fetal"
          ],
          "ask": "Most of this label went to the atlas cell set, but the cell set draws on three other Lorenzi labels besides. Ask what defines corpus spongiosum mesenchyme and whether Lorenzi treats it as continuous with lower urogenital sinus and lower vaginal mesenchyme."
        },
        {
          "subatlas_cell_label": "Fallopian Mese",
          "serves": [
            "Mesen_FallopianFib_Fetal"
          ],
          "ask": "Clean correspondence in both directions. Full characterisation of fetal fallopian tube mesenchyme: markers, position along the Mullerian duct, timing."
        },
        {
          "subatlas_cell_label": "Fallopian Lig",
          "serves": [
            "Mesen_FallopianLig_Fetal",
            "Mesen_FallopianFib_Fetal"
          ],
          "ask": "Lorenzi separates ligamentous from tubal mesenchyme and the atlas keeps that split, but a quarter of this label landed in the atlas's fallopian fibroblast cell set. Ask what marks ligament mesenchyme as distinct from the tube wall it attaches to."
        },
        {
          "subatlas_cell_label": "Uterus Mese",
          "serves": [
            "Mesen_UterusFibs_Fetal",
            "Mesen_UGSFib_Upper"
          ],
          "ask": "Clean match to the fetal uterine cell set. Also ask where Lorenzi puts the boundary between uterine and upper urogenital sinus mesenchyme, since a quarter of what Lorenzi gave the atlas's upper-UGS cell set it had called uterine."
        },
        {
          "subatlas_cell_label": "Uterus Lig",
          "serves": [
            "Mesen_UterusLig_Fetal"
          ],
          "ask": "Good two-way correspondence. Characterise uterine ligament mesenchyme and ask whether Lorenzi regards the uterine and fallopian ligament populations as one lineage."
        },
        {
          "subatlas_cell_label": "Cervix Mese",
          "serves": [
            "Mesen_CervixFib_Fetal",
            "Mesen_UterusFibs_Fetal"
          ],
          "ask": "The atlas's fetal cervical fibroblast cell set is assembled from three separate Lorenzi labels and none of them dominates it; conversely this label splits between the atlas's cervical and uterine cell sets. The specific question is whether Lorenzi draws a cervix/corpus boundary in fetal mesenchyme at all, or treats it as a gradient the atlas has cut."
        },
        {
          "subatlas_cell_label": "Cervix/Vagina Lig",
          "serves": [
            "Mesen_CervixFib_Fetal",
            "Mesen_UterusLig_Fetal"
          ],
          "ask": "Most of this label went to the atlas's cervical fibroblasts, which means the atlas merged cervicovaginal ligament mesenchyme into cervical stroma. Ask what Lorenzi takes the ligament population to be and whether it is spatially separable from cervical stroma."
        },
        {
          "subatlas_cell_label": "Upper Vagina Mese",
          "serves": [
            "Mesen_VaginaFibs_Upper_Fetal"
          ],
          "ask": "Clean two-way match. Full characterisation, and ask specifically about Mullerian versus urogenital sinus origin of upper vaginal mesenchyme, since the atlas separates upper from lower vagina."
        },
        {
          "subatlas_cell_label": "Lower Vagina Mese",
          "serves": [
            "Mesen_CorpusSpongiosumFib_Fetal",
            "Mesen_UGSFib_Lower"
          ],
          "ask": "Important negative: the atlas's own Mesen_VaginaFib_Lower_Fetal has no upstream support above the floor, and Lorenzi's lower vaginal mesenchyme instead went mostly to corpus spongiosum and lower urogenital sinus. Ask whether Lorenzi distinguishes lower vaginal mesenchyme from urogenital sinus derivatives — this is the evidence for or against the atlas's lower-vagina cell set existing as a separate population."
        },
        {
          "subatlas_cell_label": "Lower Urogenital Sinus Mese",
          "serves": [
            "Mesen_UGSFib_Lower",
            "Mesen_CorpusSpongiosumFib_Fetal"
          ],
          "ask": "Sole source for the atlas's lower-UGS cell set. Characterise it, and ask how far it extends into the structures the atlas calls corpus spongiosum and lower vagina."
        },
        {
          "subatlas_cell_label": "Upper Urogenital Sinus Mese",
          "serves": [
            "Mesen_UGSFib_Upper",
            "Mesen_VaginaFibs_Upper_Fetal"
          ],
          "ask": "One of three Lorenzi UGS labels the atlas merged into a single upper-UGS cell set. Ask what separates upper from lower urogenital sinus mesenchyme, and where the upper UGS meets the upper vagina."
        },
        {
          "subatlas_cell_label": "Urogenital Sinus Lig",
          "serves": [
            "Mesen_UGSFib_Upper",
            "Mesen_UGSLig",
            "Mesen_UGSFib_Lower"